{
  "$schema": "https://json-schema.org/draft/2020-12/schema",
  "$id": "https://soundgraph.dev/schema/patch.schema.json",
  "title": "SoundGraph Patch",
  "description": "The canonical, portable representation of a SoundGraph patch. This document is the product; editors, runtimes and hardware targets are consumers of it. Anything a frontend needs in order to reproduce a patch must round-trip through this format.",
  "type": "object",
  "required": [
    "schema_version",
    "nodes",
    "connections"
  ],
  "additionalProperties": false,
  "properties": {
    "schema_version": {
      "description": "Incremented only for breaking changes. A runtime must refuse a patch whose schema_version it does not implement. Version 2 adds modules; a document without modules stays version 1.",
      "type": "integer",
      "enum": [
        1,
        2
      ]
    },
    "modules": {
      "description": "Module definitions, by name. Present only in version 2 documents.",
      "type": "object",
      "additionalProperties": {
        "$ref": "#/$defs/module"
      }
    },
    "arrangement": {
      "description": "Optional presentation hints. Never affects what a patch sounds like, and a runtime that only wants to make sound should ignore this whole object. Node positions and cable waypoints stay on the elements they describe; this is for hints about a whole view, which have nothing to hang off. Every field is optional and dropping any of them costs a nicer picture and nothing else.",
      "type": "object",
      "additionalProperties": false,
      "properties": {
        "rack_order": {
          "description": "Left-to-right order of modules in the rack view. Ids not in the patch are ignored, and nodes missing from the list are appended, so an out-of-date list degrades rather than breaks.",
          "type": "array",
          "items": {
            "$ref": "#/$defs/node_id"
          }
        }
      }
    },
    "metadata": {
      "type": "object",
      "additionalProperties": true,
      "properties": {
        "name": {
          "type": "string"
        },
        "author": {
          "type": "string"
        },
        "description": {
          "type": "string"
        },
        "created": {
          "type": "string"
        },
        "modified": {
          "type": "string"
        },
        "tags": {
          "type": "array",
          "items": {
            "type": "string"
          }
        }
      }
    },
    "nodes": {
      "type": "array",
      "items": {
        "$ref": "#/$defs/node"
      }
    },
    "connections": {
      "type": "array",
      "items": {
        "$ref": "#/$defs/connection"
      }
    },
    "controls": {
      "description": "Performance surface. Deliberately separate from the DSP graph: the same parameter may be driven by a Godot knob, a browser slider, a DAW automation lane, a MIDI CC or a physical encoder without changing the graph.",
      "type": "array",
      "items": {
        "$ref": "#/$defs/control"
      }
    },
    "automation": {
      "description": "Recorded or authored parameter movement. Graph data, never hidden frontend state.",
      "type": "array",
      "items": {
        "$ref": "#/$defs/automation_lane"
      }
    },
    "sequence": {
      "description": "An optional looped step sequence, played by the editor through the same note path as the on-screen keys. A runtime that only wants to make sound may ignore it entirely; dropping it costs the tune and nothing else.",
      "type": "object",
      "additionalProperties": false,
      "properties": {
        "tempo": {
          "description": "Beats per minute.",
          "type": "number",
          "minimum": 40,
          "maximum": 240
        },
        "steps": {
          "description": "Loop length, in sixteenth-note steps.",
          "type": "integer",
          "minimum": 1,
          "maximum": 256
        },
        "notes": {
          "description": "The notes on the grid.",
          "type": "array",
          "items": {
            "type": "object",
            "additionalProperties": false,
            "required": [
              "step",
              "note"
            ],
            "properties": {
              "step": {
                "description": "Which step the note starts on, from zero.",
                "type": "integer",
                "minimum": 0
              },
              "note": {
                "description": "MIDI note number.",
                "type": "integer",
                "minimum": 0,
                "maximum": 127
              },
              "length": {
                "description": "How many steps the note holds for.",
                "type": "integer",
                "minimum": 1
              }
            }
          }
        }
      }
    },
    "presets": {
      "description": "Named snapshots of the performance surface: the sound bank. A preset stores values by control id, never by node, so the graph can be rearranged without breaking the bank. Structure lives in nodes and connections; character lives here. The lesson of every patcher without this key is that it cannot be an afterthought.",
      "type": "array",
      "items": {
        "$ref": "#/$defs/preset"
      }
    }
  },
  "$defs": {
    "node_id": {
      "description": "Stable identity. Must survive rename, move, and re-serialization; connections and automation refer to it.",
      "type": "string",
      "minLength": 1,
      "maxLength": 64,
      "pattern": "^[A-Za-z0-9_.:-]+$"
    },
    "port_name": {
      "type": "string",
      "minLength": 1,
      "maxLength": 64,
      "pattern": "^[A-Za-z0-9_]+$"
    },
    "signal_type": {
      "description": "audio and control are sample streams and interconvert freely. event and note are discrete messages and require an exact match.",
      "type": "string",
      "enum": [
        "audio",
        "control",
        "event",
        "note"
      ]
    },
    "node": {
      "type": "object",
      "required": [
        "id",
        "type"
      ],
      "additionalProperties": false,
      "properties": {
        "id": {
          "$ref": "#/$defs/node_id"
        },
        "type": {
          "description": "Registry node type name, e.g. SawOscillator. Unknown types are a validation error, never a silent no-op.",
          "type": "string",
          "minLength": 1
        },
        "name": {
          "description": "Human-facing label. Purely cosmetic; never used for identity.",
          "type": "string"
        },
        "parameters": {
          "description": "Parameter values by name. Omitted parameters take the registry default, so a minimal patch stays readable.",
          "type": "object",
          "additionalProperties": {
            "type": "number"
          }
        },
        "position": {
          "description": "Editor layout hint. Runtimes ignore it; it lives here so a patch opens the same way in every editor.",
          "type": "object",
          "additionalProperties": false,
          "properties": {
            "x": {
              "type": "number"
            },
            "y": {
              "type": "number"
            }
          }
        },
        "collapsed": {
          "description": "Progressive disclosure state for editors.",
          "type": "boolean"
        },
        "module": {
          "description": "When type is \"module\": the name of the definition this node instantiates. The instance exposes only the module's declared inputs, outputs and parameters.",
          "type": "string",
          "minLength": 1
        },
        "host": {
          "description": "Only on a seam \u2014 a node of type \"Input\" or \"Output\". Names the side of the machine this edge meets: \"note\" or \"audio\" for an input, \"stereo\" for an output. A seam inside a module must not carry one, because a module's seams are its ports and binding one to the machine would mean every instance shared that one keyboard. A seam at the top level may or may not: with a host it is where the graph meets its machine, and becomes the matching terminal node when the patch is loaded; without one it is a socket nothing is currently plugged into, and is spliced out at load, so whatever it fed goes silent. Nothing downstream of the loader learns the word either way.",
          "type": "string",
          "enum": [
            "note",
            "audio",
            "stereo"
          ]
        }
      }
    },
    "endpoint": {
      "type": "object",
      "required": [
        "node",
        "port"
      ],
      "additionalProperties": false,
      "properties": {
        "node": {
          "$ref": "#/$defs/node_id"
        },
        "port": {
          "$ref": "#/$defs/port_name"
        }
      }
    },
    "connection": {
      "type": "object",
      "required": [
        "from",
        "to"
      ],
      "additionalProperties": false,
      "properties": {
        "from": {
          "description": "Source: an output port.",
          "$ref": "#/$defs/endpoint"
        },
        "to": {
          "description": "Destination: an input port. An input accepts at most one connection unless the node type declares the port summing.",
          "$ref": "#/$defs/endpoint"
        },
        "waypoint": {
          "description": "Editor layout hint: a point the cable is routed through, set by dragging it. Like node positions, runtimes ignore it and it lives here so a patch looks the same in every editor.",
          "type": "object",
          "additionalProperties": false,
          "properties": {
            "x": {
              "type": "number"
            },
            "y": {
              "type": "number"
            }
          }
        }
      }
    },
    "control": {
      "type": "object",
      "required": [
        "id",
        "target"
      ],
      "additionalProperties": false,
      "properties": {
        "id": {
          "$ref": "#/$defs/node_id"
        },
        "label": {
          "type": "string"
        },
        "group": {
          "description": "Panel grouping. Controls sharing a group are drawn as one block on the performance surface, whatever nodes they target \u00e2\u20ac\u201d an operator's own knobs and the gain node that sets its level belong together on the panel even though they are separate nodes in the graph. Absent means the control groups with others targeting the same node. Panel organization, never graph semantics.",
          "type": "string",
          "minLength": 1,
          "maxLength": 64
        },
        "kind": {
          "type": "string",
          "enum": [
            "knob",
            "slider",
            "toggle",
            "button",
            "xy",
            "keyboard"
          ]
        },
        "target": {
          "description": "The graph parameter this surface drives.",
          "type": "object",
          "required": [
            "node",
            "parameter"
          ],
          "additionalProperties": false,
          "properties": {
            "node": {
              "$ref": "#/$defs/node_id"
            },
            "parameter": {
              "$ref": "#/$defs/port_name"
            }
          }
        },
        "min": {
          "type": "number"
        },
        "max": {
          "type": "number"
        },
        "default": {
          "type": "number"
        },
        "scaling": {
          "type": "string",
          "enum": [
            "linear",
            "exponential",
            "logarithmic"
          ]
        },
        "binding": {
          "description": "Optional physical or protocol binding. Absent means the surface is on-screen only.",
          "type": "object",
          "additionalProperties": true,
          "properties": {
            "midi_cc": {
              "type": "integer",
              "minimum": 0,
              "maximum": 127
            },
            "midi_channel": {
              "type": "integer",
              "minimum": 1,
              "maximum": 16
            },
            "encoder": {
              "type": "integer",
              "minimum": 0
            }
          }
        }
      }
    },
    "automation_lane": {
      "type": "object",
      "required": [
        "target",
        "points"
      ],
      "additionalProperties": false,
      "properties": {
        "id": {
          "$ref": "#/$defs/node_id"
        },
        "target": {
          "type": "object",
          "required": [
            "node",
            "parameter"
          ],
          "additionalProperties": false,
          "properties": {
            "node": {
              "$ref": "#/$defs/node_id"
            },
            "parameter": {
              "$ref": "#/$defs/port_name"
            }
          }
        },
        "loop": {
          "type": "boolean"
        },
        "length_seconds": {
          "type": "number",
          "exclusiveMinimum": 0
        },
        "interpolation": {
          "type": "string",
          "enum": [
            "step",
            "linear",
            "smooth"
          ]
        },
        "points": {
          "type": "array",
          "items": {
            "type": "object",
            "required": [
              "time",
              "value"
            ],
            "additionalProperties": false,
            "properties": {
              "time": {
                "type": "number",
                "minimum": 0
              },
              "value": {
                "type": "number"
              }
            }
          }
        }
      }
    },
    "module_port": {
      "type": "object",
      "required": [
        "name",
        "node",
        "port"
      ],
      "additionalProperties": false,
      "properties": {
        "name": {
          "type": "string",
          "minLength": 1
        },
        "node": {
          "$ref": "#/$defs/node_id"
        },
        "port": {
          "$ref": "#/$defs/port_name"
        }
      }
    },
    "module_parameter": {
      "type": "object",
      "required": [
        "name",
        "node",
        "parameter"
      ],
      "additionalProperties": false,
      "properties": {
        "name": {
          "type": "string",
          "minLength": 1
        },
        "node": {
          "$ref": "#/$defs/node_id"
        },
        "parameter": {
          "type": "string",
          "minLength": 1
        }
      }
    },
    "module": {
      "description": "A named subgraph with a declared surface. Instances are expanded into plain nodes at load; a module is notation, not a runtime object. Definitions may not instantiate modules (no nesting). See docs/modules-design.md.",
      "type": "object",
      "required": [
        "nodes",
        "connections"
      ],
      "additionalProperties": false,
      "properties": {
        "description": {
          "type": "string"
        },
        "nodes": {
          "type": "array",
          "items": {
            "$ref": "#/$defs/node"
          }
        },
        "connections": {
          "type": "array",
          "items": {
            "$ref": "#/$defs/connection"
          }
        },
        "inputs": {
          "type": "array",
          "items": {
            "$ref": "#/$defs/module_port"
          }
        },
        "outputs": {
          "type": "array",
          "items": {
            "$ref": "#/$defs/module_port"
          }
        },
        "parameters": {
          "type": "array",
          "items": {
            "$ref": "#/$defs/module_parameter"
          }
        },
        "panel": {
          "$ref": "#/$defs/module_panel"
        }
      }
    },
    "module_panel": {
      "description": "The face an instance wears. Presentation only, like arrangement: it never changes what a patch sounds like and never changes the declared surface. An exported parameter left off the panel is still exported, still settable per instance, and still a legal control or automation target \u2014 it simply has no knob. Omit the whole object to get every export in declared order.",
      "type": "object",
      "additionalProperties": false,
      "properties": {
        "rows": {
          "description": "Exported parameter names, grouped into panel rows, left to right and top to bottom. A name this module does not export is ignored, so an out-of-date panel degrades rather than breaks. Unlike arrangement.rack_order, exports missing from the rows are NOT appended: leaving one out is the authoring act.",
          "type": "array",
          "items": {
            "type": "array",
            "items": {
              "type": "string"
            }
          }
        },
        "labels": {
          "description": "What the panel calls an export, by exported name. Derived export names like \"op1_gain\" say where a knob goes; a caption says what it does.",
          "type": "object",
          "additionalProperties": {
            "type": "string"
          }
        }
      }
    },
    "preset": {
      "type": "object",
      "required": [
        "name",
        "values"
      ],
      "additionalProperties": false,
      "properties": {
        "name": {
          "type": "string",
          "minLength": 1,
          "maxLength": 64
        },
        "author": {
          "type": "string"
        },
        "tags": {
          "type": "array",
          "items": {
            "type": "string"
          }
        },
        "values": {
          "description": "Control id to the value its target takes.",
          "type": "object",
          "additionalProperties": true
        }
      }
    }
  }
}
