{
  "schema_version": 1,
  "metadata": {
    "name": "Breath Noise",
    "description": "Breath Noise — Freedoom's OPL2 GENMIDI voice, imported by tools/opl2-import.mjs. Approximated: feedback 6 applied without envelope scaling; modulator level key-scaling ignored; modulator tremolo/vibrato flag ignored; modulator percussive envelope approximated; carrier tremolo/vibrato flag ignored.",
    "author": "Freedoom contributors (instrument), SoundGraph opl2-import (mapping)",
    "tags": [
      "fm",
      "opl2",
      "imported"
    ],
    "source": "freedoom/lumps/genmidi/instruments/instr122.sbi"
  },
  "nodes": [
    {
      "id": "note",
      "type": "NoteInput",
      "parameters": {}
    },
    {
      "id": "mod_pitch",
      "type": "Multiply",
      "parameters": {
        "factor": 2
      }
    },
    {
      "id": "car_pitch",
      "type": "Multiply",
      "parameters": {
        "factor": 1
      }
    },
    {
      "id": "mod",
      "type": "SineOscillator",
      "parameters": {
        "feedback": 0.05788
      }
    },
    {
      "id": "mod_env",
      "type": "ADSR",
      "parameters": {
        "attack": 0.2,
        "decay": 1.4925,
        "sustain": 0,
        "release": 1.4885
      }
    },
    {
      "id": "mod_vca",
      "type": "Multiply",
      "parameters": {}
    },
    {
      "id": "car",
      "type": "SineOscillator",
      "parameters": {}
    },
    {
      "id": "car_env",
      "type": "ADSR",
      "parameters": {
        "attack": 0.2,
        "decay": 0.144,
        "sustain": 0.3548,
        "release": 1.3444
      }
    },
    {
      "id": "car_vca",
      "type": "Multiply",
      "parameters": {}
    },
    {
      "id": "out",
      "type": "StereoOutput",
      "parameters": {
        "level": 0.8
      }
    },
    {
      "id": "index",
      "type": "Gain",
      "parameters": {
        "gain": 0.0492
      }
    },
    {
      "id": "car_level",
      "type": "Gain",
      "parameters": {
        "gain": 0.5464
      }
    }
  ],
  "connections": [
    {
      "from": {
        "node": "note",
        "port": "frequency"
      },
      "to": {
        "node": "mod_pitch",
        "port": "a"
      }
    },
    {
      "from": {
        "node": "note",
        "port": "frequency"
      },
      "to": {
        "node": "car_pitch",
        "port": "a"
      }
    },
    {
      "from": {
        "node": "mod_pitch",
        "port": "out"
      },
      "to": {
        "node": "mod",
        "port": "frequency"
      }
    },
    {
      "from": {
        "node": "car_pitch",
        "port": "out"
      },
      "to": {
        "node": "car",
        "port": "frequency"
      }
    },
    {
      "from": {
        "node": "note",
        "port": "gate"
      },
      "to": {
        "node": "mod_env",
        "port": "gate"
      }
    },
    {
      "from": {
        "node": "note",
        "port": "gate"
      },
      "to": {
        "node": "car_env",
        "port": "gate"
      }
    },
    {
      "from": {
        "node": "mod",
        "port": "out"
      },
      "to": {
        "node": "mod_vca",
        "port": "a"
      }
    },
    {
      "from": {
        "node": "mod_env",
        "port": "out"
      },
      "to": {
        "node": "mod_vca",
        "port": "b"
      }
    },
    {
      "from": {
        "node": "car",
        "port": "out"
      },
      "to": {
        "node": "car_vca",
        "port": "a"
      }
    },
    {
      "from": {
        "node": "car_env",
        "port": "out"
      },
      "to": {
        "node": "car_vca",
        "port": "b"
      }
    },
    {
      "from": {
        "node": "mod_vca",
        "port": "out"
      },
      "to": {
        "node": "index",
        "port": "in"
      }
    },
    {
      "from": {
        "node": "index",
        "port": "out"
      },
      "to": {
        "node": "car",
        "port": "pm"
      }
    },
    {
      "from": {
        "node": "car_vca",
        "port": "out"
      },
      "to": {
        "node": "car_level",
        "port": "in"
      }
    },
    {
      "from": {
        "node": "car_level",
        "port": "out"
      },
      "to": {
        "node": "out",
        "port": "left"
      }
    },
    {
      "from": {
        "node": "car_level",
        "port": "out"
      },
      "to": {
        "node": "out",
        "port": "right"
      }
    }
  ]
}
