{
  "schema_version": 1,
  "metadata": {
    "name": "PluginInstrument",
    "description": "A VST3 or CLAP synth from elsewhere, played from the keyboard. Try: Choose an installed synth and play it. It takes every note itself rather than one per voice, because a hosted synth does its own polyphony — so voices on a NoteInput above it change nothing, and a filter after it filters the whole chord rather than each note. With no plugin chosen it stays silent, which is the node waiting rather than the patch being broken. Generated by tools/node-demos.mjs. Do not edit by hand.",
    "tags": [
      "demo",
      "node"
    ]
  },
  "nodes": [
    {
      "id": "demo",
      "type": "PluginInstrument",
      "position": {
        "x": 0,
        "y": 0
      }
    },
    {
      "id": "tone",
      "type": "StateVariableFilter",
      "position": {
        "x": 560,
        "y": 0
      },
      "parameters": {
        "cutoff": 3000,
        "resonance": 0.2
      }
    },
    {
      "id": "out",
      "type": "Output",
      "host": "stereo",
      "position": {
        "x": 1120,
        "y": 0
      },
      "parameters": {
        "level": 0.8,
        "safety_limit": 1
      }
    }
  ],
  "connections": [
    {
      "from": {
        "node": "demo",
        "port": "left"
      },
      "to": {
        "node": "tone",
        "port": "in"
      }
    },
    {
      "from": {
        "node": "tone",
        "port": "out"
      },
      "to": {
        "node": "out",
        "port": "left"
      }
    },
    {
      "from": {
        "node": "demo",
        "port": "right"
      },
      "to": {
        "node": "out",
        "port": "right"
      }
    }
  ]
}
