{
  "schema_version": 2,
  "metadata": {
    "name": "Fiddle",
    "description": "Fiddle — Freedoom's OPL2 GENMIDI voice, imported by tools/opl2-import.mjs. Approximated: feedback 7 applied without envelope scaling.",
    "author": "Freedoom contributors (instrument), SoundGraph opl2-import (mapping)",
    "tags": [
      "fm",
      "opl2",
      "imported"
    ],
    "source": "freedoom/lumps/genmidi/instruments/instr111.sbi"
  },
  "modules": {
    "opl2_operator": {
      "description": "One OPL2 operator: pitch ratio, shaped sine, envelope, VCA.",
      "nodes": [
        {
          "id": "pitch",
          "type": "Multiply",
          "parameters": {
            "factor": 1
          }
        },
        {
          "id": "osc",
          "type": "SineOscillator",
          "parameters": {}
        },
        {
          "id": "env",
          "type": "ADSR",
          "parameters": {}
        },
        {
          "id": "vca",
          "type": "Multiply",
          "parameters": {}
        }
      ],
      "connections": [
        {
          "from": {
            "node": "pitch",
            "port": "out"
          },
          "to": {
            "node": "osc",
            "port": "frequency"
          }
        },
        {
          "from": {
            "node": "osc",
            "port": "out"
          },
          "to": {
            "node": "vca",
            "port": "a"
          }
        },
        {
          "from": {
            "node": "env",
            "port": "out"
          },
          "to": {
            "node": "vca",
            "port": "b"
          }
        }
      ],
      "inputs": [
        {
          "name": "note",
          "node": "pitch",
          "port": "a"
        },
        {
          "name": "gate",
          "node": "env",
          "port": "gate"
        },
        {
          "name": "pm",
          "node": "osc",
          "port": "pm"
        }
      ],
      "outputs": [
        {
          "name": "out",
          "node": "vca",
          "port": "out"
        }
      ],
      "parameters": [
        {
          "name": "ratio",
          "node": "pitch",
          "parameter": "factor"
        },
        {
          "name": "shape",
          "node": "osc",
          "parameter": "shape"
        },
        {
          "name": "feedback",
          "node": "osc",
          "parameter": "feedback"
        },
        {
          "name": "attack",
          "node": "env",
          "parameter": "attack"
        },
        {
          "name": "decay",
          "node": "env",
          "parameter": "decay"
        },
        {
          "name": "sustain",
          "node": "env",
          "parameter": "sustain"
        },
        {
          "name": "release",
          "node": "env",
          "parameter": "release"
        }
      ]
    }
  },
  "nodes": [
    {
      "id": "note",
      "type": "Input",
      "host": "note",
      "name": "Keyboard",
      "parameters": {}
    },
    {
      "id": "mod",
      "type": "module",
      "module": "opl2_operator",
      "name": "Modulator",
      "parameters": {
        "ratio": 0.5,
        "attack": 0.0016,
        "decay": 0.2561,
        "sustain": 1,
        "release": 5.9539,
        "shape": 3,
        "feedback": 0.14998
      }
    },
    {
      "id": "car",
      "type": "module",
      "module": "opl2_operator",
      "name": "Carrier",
      "parameters": {
        "ratio": 1,
        "attack": 0.07,
        "decay": 1.1519,
        "sustain": 0.5012,
        "release": 1.0439
      }
    },
    {
      "id": "out",
      "type": "Output",
      "host": "stereo",
      "parameters": {
        "level": 0.8
      }
    },
    {
      "id": "index",
      "type": "Gain",
      "name": "Modulator → Carrier",
      "parameters": {
        "gain": 0.0637
      }
    },
    {
      "id": "car_level",
      "type": "Gain",
      "name": "Carrier level",
      "parameters": {
        "gain": 1
      }
    }
  ],
  "connections": [
    {
      "from": {
        "node": "note",
        "port": "frequency"
      },
      "to": {
        "node": "mod",
        "port": "note"
      }
    },
    {
      "from": {
        "node": "note",
        "port": "frequency"
      },
      "to": {
        "node": "car",
        "port": "note"
      }
    },
    {
      "from": {
        "node": "note",
        "port": "gate"
      },
      "to": {
        "node": "mod",
        "port": "gate"
      }
    },
    {
      "from": {
        "node": "note",
        "port": "gate"
      },
      "to": {
        "node": "car",
        "port": "gate"
      }
    },
    {
      "from": {
        "node": "mod",
        "port": "out"
      },
      "to": {
        "node": "index",
        "port": "in"
      }
    },
    {
      "from": {
        "node": "index",
        "port": "out"
      },
      "to": {
        "node": "car",
        "port": "pm"
      }
    },
    {
      "from": {
        "node": "car",
        "port": "out"
      },
      "to": {
        "node": "car_level",
        "port": "in"
      }
    },
    {
      "from": {
        "node": "car_level",
        "port": "out"
      },
      "to": {
        "node": "out",
        "port": "left"
      }
    },
    {
      "from": {
        "node": "car_level",
        "port": "out"
      },
      "to": {
        "node": "out",
        "port": "right"
      }
    }
  ]
}
