{
  "schema_version": 1,
  "metadata": {
    "name": "SawOscillator",
    "description": "Every harmonic at once — the bright, buzzy synth starting point. Try: Play it, then open the StateVariableFilter demo. This is what that is carving. Generated by tools/node-demos.mjs. Do not edit by hand.",
    "tags": [
      "demo",
      "node"
    ]
  },
  "nodes": [
    {
      "id": "kb",
      "type": "NoteInput",
      "position": {
        "x": 0,
        "y": 200
      }
    },
    {
      "id": "demo",
      "type": "SawOscillator",
      "position": {
        "x": 400,
        "y": 0
      },
      "parameters": {
        "frequency": 220
      }
    },
    {
      "id": "env",
      "type": "AhdEnvelope",
      "position": {
        "x": 400,
        "y": 200
      },
      "parameters": {
        "attack": 0.005,
        "hold": 0.15,
        "decay": 0.35
      }
    },
    {
      "id": "amp",
      "type": "Gain",
      "position": {
        "x": 800,
        "y": 0
      },
      "parameters": {
        "gain": 0.7
      }
    },
    {
      "id": "out",
      "type": "StereoOutput",
      "position": {
        "x": 1200,
        "y": 0
      },
      "parameters": {
        "level": 0.8,
        "safety_limit": 1
      }
    }
  ],
  "connections": [
    {
      "from": {
        "node": "kb",
        "port": "frequency"
      },
      "to": {
        "node": "demo",
        "port": "frequency"
      }
    },
    {
      "from": {
        "node": "kb",
        "port": "trigger"
      },
      "to": {
        "node": "env",
        "port": "gate"
      }
    },
    {
      "from": {
        "node": "env",
        "port": "out"
      },
      "to": {
        "node": "amp",
        "port": "gain"
      }
    },
    {
      "from": {
        "node": "demo",
        "port": "out"
      },
      "to": {
        "node": "amp",
        "port": "in"
      }
    },
    {
      "from": {
        "node": "amp",
        "port": "out"
      },
      "to": {
        "node": "out",
        "port": "left"
      }
    },
    {
      "from": {
        "node": "amp",
        "port": "out"
      },
      "to": {
        "node": "out",
        "port": "right"
      }
    }
  ]
}
