{
  "schema_version": 1,
  "metadata": {
    "name": "Clip",
    "description": "Keeps a signal between a floor and a ceiling. The hard limit as a building block. Try: The vibrato is wide, but the clip holds its top at a semitone above centre. Raise ceiling and the upward swings come back; lower it to zero and the pitch can only dip. Generated by tools/node-demos.mjs. Do not edit by hand.",
    "tags": [
      "demo",
      "node"
    ]
  },
  "nodes": [
    {
      "id": "kb",
      "type": "Input",
      "host": "note",
      "position": {
        "x": 0,
        "y": 360
      }
    },
    {
      "id": "lfo",
      "type": "LFO",
      "position": {
        "x": 560,
        "y": 720
      },
      "parameters": {
        "rate": 4,
        "shape": 0,
        "amount": 0.12,
        "offset": 0
      }
    },
    {
      "id": "demo",
      "type": "Clip",
      "position": {
        "x": 1120,
        "y": 720
      },
      "parameters": {
        "floor": -0.12,
        "ceiling": 0.02
      }
    },
    {
      "id": "osc",
      "type": "SawOscillator",
      "position": {
        "x": 1120,
        "y": 0
      },
      "parameters": {
        "frequency": 220
      }
    },
    {
      "id": "env",
      "type": "AhdEnvelope",
      "position": {
        "x": 1120,
        "y": 360
      },
      "parameters": {
        "attack": 0.005,
        "hold": 0.15,
        "decay": 0.35
      }
    },
    {
      "id": "amp",
      "type": "Gain",
      "position": {
        "x": 1680,
        "y": 0
      },
      "parameters": {
        "gain": 0.7
      }
    },
    {
      "id": "out",
      "type": "Output",
      "host": "stereo",
      "position": {
        "x": 2240,
        "y": 0
      },
      "parameters": {
        "level": 0.8,
        "safety_limit": 1
      }
    }
  ],
  "connections": [
    {
      "from": {
        "node": "kb",
        "port": "frequency"
      },
      "to": {
        "node": "osc",
        "port": "frequency"
      }
    },
    {
      "from": {
        "node": "lfo",
        "port": "out"
      },
      "to": {
        "node": "demo",
        "port": "in"
      }
    },
    {
      "from": {
        "node": "demo",
        "port": "out"
      },
      "to": {
        "node": "osc",
        "port": "fm"
      }
    },
    {
      "from": {
        "node": "kb",
        "port": "trigger"
      },
      "to": {
        "node": "env",
        "port": "gate"
      }
    },
    {
      "from": {
        "node": "env",
        "port": "out"
      },
      "to": {
        "node": "amp",
        "port": "gain"
      }
    },
    {
      "from": {
        "node": "osc",
        "port": "out"
      },
      "to": {
        "node": "amp",
        "port": "in"
      }
    },
    {
      "from": {
        "node": "amp",
        "port": "out"
      },
      "to": {
        "node": "out",
        "port": "left"
      }
    },
    {
      "from": {
        "node": "amp",
        "port": "out"
      },
      "to": {
        "node": "out",
        "port": "right"
      }
    }
  ]
}
